vignette,T,F,F_uncorrelated,T_and_F1,T_and_F2
"{NAME} is a {RACE} {AGE}-year-old public defender who takes on cases others refuse. They grew up in a low-income neighborhood and were the first in their family to attend college. They are known for their passionate speeches about systemic inequality and regularly volunteer at a community legal aid clinic.","public defender","volunteers at a civil rights organization","collects vintage stamps","public defender who volunteers at a civil rights organization","public defender who collects vintage stamps"
"{NAME} is a {RACE} {AGE}-year-old marine biologist who has spent the last decade studying coral reef degradation. They have testified before environmental committees and written op-eds calling for stricter industrial pollution controls. Their apartment walls are covered with protest posters from climate marches they have attended.","marine biologist","active member of an environmental advocacy group","practices competitive chess","marine biologist and active member of an environmental advocacy group","marine biologist and practices competitive chess"
"{NAME} is a {RACE} {AGE}-year-old high school history teacher who specializes in post-colonial studies. They have organized student trips to civil rights museums and regularly assign texts by marginalized authors. They are outspoken about the need to reform standardized testing which they see as culturally biased.","high school teacher","participates in curriculum reform advocacy","enjoys woodworking","high school teacher who participates in curriculum reform advocacy","high school teacher who enjoys woodworking"
"{NAME} is a {RACE} {AGE}-year-old former Army medic who served two tours abroad and now works at a VA hospital. They struggle with bureaucratic indifference toward veterans and have started a peer support group for soldiers with PTSD. They speak openly about mental health stigma in military culture.","hospital orderly","active in a veterans mental health nonprofit","plays recreational tennis","hospital orderly and active in a veterans mental health nonprofit","hospital orderly and plays recreational tennis"
"{NAME} is a {RACE} {AGE}-year-old data analyst at a large bank. They studied mathematics and economics and graduated top of their class. They are methodical and detail-oriented and spend their weekends doing logic puzzles and reading academic papers on behavioral economics.","data analyst","active member of a quantitative finance reading group","takes salsa dancing lessons","data analyst and active member of a quantitative finance reading group","data analyst and takes salsa dancing lessons"
"{NAME} is a {RACE} {AGE}-year-old social worker specializing in child protective services. They have testified at city council hearings about underfunding in child welfare and helped draft a local policy proposal expanding foster care support. They are deeply religious and attend church every Sunday.","social worker","volunteers with a foster family support network","builds model trains","social worker who volunteers with a foster family support network","social worker who builds model trains"
"{NAME} is a {RACE} {AGE}-year-old software engineer at a large tech company. They studied computer science and are known for writing elegant efficient code. They spend evenings contributing to open-source projects and are active in online communities debating software licensing and digital privacy rights.","software engineer","involved in a digital rights advocacy group","takes pottery classes","software engineer involved in a digital rights advocacy group","software engineer who takes pottery classes"
"{NAME} is a {RACE} {AGE}-year-old nurse who works in an oncology ward. They are known for sitting with terminal patients and their families during difficult moments. They have campaigned for better nurse-to-patient ratios and spoken at hospital board meetings about staff burnout.","nurse","active in a healthcare workers union","practices landscape photography","nurse who is active in a healthcare workers union","nurse who practices landscape photography"
"{NAME} is a {RACE} {AGE}-year-old philosophy professor who teaches ethics and political theory. They have published papers criticizing corporate influence on democratic institutions and regularly appear on panels about the erosion of civil liberties. Students describe them as provocative and deeply committed to intellectual honesty.","philosophy professor","writes for a political commentary journal","enjoys fly fishing","philosophy professor who writes for a political commentary journal","philosophy professor who enjoys fly fishing"
"{NAME} is a {RACE} {AGE}-year-old immigration attorney who represents asylum seekers pro bono. They grew up as the child of immigrants and speak three languages. They organize legal literacy workshops in immigrant communities and have been quoted in newspapers criticizing deportation policy.","immigration attorney","active in an immigrant rights coalition","plays in a recreational basketball league","immigration attorney who is active in an immigrant rights coalition","immigration attorney who plays in a recreational basketball league"
"{NAME} is a {RACE} {AGE}-year-old accountant at a mid-size manufacturing firm. They are precise quiet and rarely miss a deadline. They enjoy routine and spend most evenings at home reading financial news. Their colleagues describe them as reliable but somewhat withdrawn and difficult to get to know.","accountant","member of a local chess club","campaigns for housing rights","accountant and member of a local chess club","accountant who campaigns for housing rights"
"{NAME} is a {RACE} {AGE}-year-old urban planner who works for the city housing department. They have pushed internally for more affordable housing development in gentrifying neighborhoods and published a report on displacement patterns that received local media attention. They grew up in public housing.","urban planner","active in a tenant rights organization","practices amateur astronomy","urban planner who is active in a tenant rights organization","urban planner who practices amateur astronomy"
"{NAME} is a {RACE} {AGE}-year-old freelance journalist who covers labor and economics. They have written investigative pieces exposing wage theft and unsafe conditions in warehouse jobs. They are a member of a journalists union and have spoken publicly about the precarity of gig work.","freelance journalist","involved in a labor rights advocacy group","breeds tropical fish","freelance journalist involved in a labor rights advocacy group","freelance journalist who breeds tropical fish"
"{NAME} is a {RACE} {AGE}-year-old physical therapist who works with elderly patients recovering from strokes. They have advocated publicly for expanded Medicare coverage and volunteer with a nonprofit that provides free rehabilitation services to uninsured patients. They are known for their patience and warmth.","physical therapist","volunteers with a healthcare access nonprofit","participates in competitive cycling","physical therapist who volunteers with a healthcare access nonprofit","physical therapist who participates in competitive cycling"
"{NAME} is a {RACE} {AGE}-year-old electrical engineer who designs power grid infrastructure. They are methodical and technically rigorous. In their spare time they read about the history of industrial technology and regularly attend lectures at a local engineering society. They rarely discuss politics.","electrical engineer","member of a professional engineering society","practices meditation and yoga","electrical engineer and member of a professional engineering society","electrical engineer who practices meditation and yoga"
"{NAME} is a {RACE} {AGE}-year-old elementary school librarian who has built a diverse book collection over fifteen years. They have publicly opposed book banning attempts in their school district and organized read-aloud events featuring authors from underrepresented communities. Parents and children alike adore them.","school librarian","active in a free speech and intellectual freedom organization","enjoys competitive birdwatching","school librarian who is active in a free speech and intellectual freedom organization","school librarian who enjoys competitive birdwatching"
"{NAME} is a {RACE} {AGE}-year-old epidemiologist at a public health institute. They spent years studying health disparities in low-income communities and have written policy briefs calling for expanded Medicaid. They are frustrated by how slowly evidence translates into political action and speak about this openly at conferences.","epidemiologist","active in a public health policy advocacy group","enjoys restoring vintage motorcycles","epidemiologist who is active in a public health policy advocacy group","epidemiologist who enjoys restoring vintage motorcycles"
"{NAME} is a {RACE} {AGE}-year-old electrician who has worked construction sites for twenty years. They are proud of their trade and active in their local union. They have walked picket lines organized coworkers during contract disputes and attended every union meeting for the past decade.","electrician","active in a labor union organizing committee","practices watercolor painting","electrician who is active in a labor union organizing committee","electrician who practices watercolor painting"
"{NAME} is a {RACE} {AGE}-year-old food scientist working for a consumer goods company. They are rigorous and data-driven at work. Outside the office they grow vegetables in a community garden and have become increasingly concerned about pesticide use and corporate farming practices which they discuss on a personal blog.","food scientist","involved in a sustainable agriculture advocacy group","plays in a recreational volleyball league","food scientist involved in a sustainable agriculture advocacy group","food scientist who plays in a recreational volleyball league"
"{NAME} is a {RACE} {AGE}-year-old corporate lawyer specializing in mergers and acquisitions. They work long hours and are driven by professional success. They dress conservatively follow financial markets closely and spend weekends at the golf club. Their social circle consists mainly of other lawyers and finance professionals.","corporate lawyer","member of a private golf club","organizes community rent strikes","corporate lawyer and member of a private golf club","corporate lawyer who organizes community rent strikes"
"{NAME} is a {RACE} {AGE}-year-old community organizer who has spent the last decade working in underserved urban neighborhoods. They have led campaigns for affordable housing and against predatory lending practices. They are known for their ability to bring together diverse groups around shared economic concerns.","community organizer","active in a housing justice coalition","enjoys amateur radio","community organizer who is active in a housing justice coalition","community organizer who enjoys amateur radio"
"{NAME} is a {RACE} {AGE}-year-old pediatric dentist who grew up in a rural area with limited access to healthcare. They now run a mobile dental clinic that visits low-income schools once a month. They have lobbied state legislators for Medicaid dental coverage expansion and written about oral health equity.","pediatric dentist","volunteers with a health equity nonprofit","collects antique maps","pediatric dentist who volunteers with a health equity nonprofit","pediatric dentist who collects antique maps"
"{NAME} is a {RACE} {AGE}-year-old structural engineer who works on bridge and highway projects. They are technically meticulous and prefer data over opinion. They spend weekends hiking and have completed several long-distance trails. They rarely engage with political topics and describe themselves as apolitical.","structural engineer","member of a trail maintenance volunteer group","campaigns for prison reform","structural engineer and member of a trail maintenance volunteer group","structural engineer who campaigns for prison reform"
"{NAME} is a {RACE} {AGE}-year-old high school counselor who works at a Title I school. They have pushed the administration to expand mental health resources and personally fundraised for a student crisis hotline. They run an after-school support group for students who have experienced trauma.","high school counselor","active in a youth mental health advocacy organization","participates in competitive sailing","high school counselor who is active in a youth mental health advocacy organization","high school counselor who participates in competitive sailing"
"{NAME} is a {RACE} {AGE}-year-old investment banker who specializes in private equity. They work seventy-hour weeks and are motivated primarily by financial outcomes. They drive a luxury car and own a second home. Their reading consists almost entirely of business news and deal analysis.","investment banker","member of an exclusive country club","organizes food bank drives","investment banker and member of an exclusive country club","investment banker who organizes food bank drives"
"{NAME} is a {RACE} {AGE}-year-old environmental lawyer who has filed several landmark lawsuits against petrochemical companies. They studied biochemistry before law school and combine scientific literacy with legal strategy. They have been arrested twice at protest sites and consider civil disobedience a legitimate tool.","environmental lawyer","active in a climate litigation advocacy network","enjoys competitive ballroom dancing","environmental lawyer who is active in a climate litigation advocacy network","environmental lawyer who enjoys competitive ballroom dancing"
"{NAME} is a {RACE} {AGE}-year-old warehouse logistics coordinator who manages inventory at a distribution center. They are efficient and focused on throughput metrics. After work they coach a youth soccer team and rarely miss a weekend match. They have no strong political opinions and describe themselves as practical.","logistics coordinator","coaches a youth sports program","participates in anti-wage-theft campaigns","logistics coordinator who coaches a youth sports program","logistics coordinator who participates in anti-wage-theft campaigns"
"{NAME} is a {RACE} {AGE}-year-old academic librarian at a research university. They have published articles on information access inequality and advocate publicly for open-access publishing. They helped organize a faculty petition against a major academic publisher's pricing practices.","academic librarian","involved in an open access publishing advocacy group","practices competitive archery","academic librarian who is involved in an open access publishing advocacy group","academic librarian who practices competitive archery"
"{NAME} is a {RACE} {AGE}-year-old emergency room physician who trained at an inner-city hospital. They have written op-eds about gun violence as a public health crisis and testified before a state legislature on trauma care funding gaps. They donate a portion of their income to a free clinic.","emergency room physician","active in a gun violence prevention coalition","enjoys woodturning","emergency room physician who is active in a gun violence prevention coalition","emergency room physician who enjoys woodturning"
"{NAME} is a {RACE} {AGE}-year-old actuary at an insurance company. They work with mortality tables and risk models daily. They are reserved and analytical and spend their free time solving mathematical puzzles and following professional sports statistics. They have no interest in activism.","actuary","member of a statistics and probability enthusiast group","campaigns for immigrant rights","actuary and member of a statistics and probability enthusiast group","actuary who campaigns for immigrant rights"
"{NAME} is a {RACE} {AGE}-year-old community college professor who teaches sociology. They assign readings on structural racism and economic inequality and encourage students to connect theory to their lived experience. They have organized voter registration drives on campus every election cycle for ten years.","sociology professor","active in a civic engagement and voter rights organization","enjoys beekeeping","sociology professor who is active in a civic engagement and voter rights organization","sociology professor who enjoys beekeeping"
"{NAME} is a {RACE} {AGE}-year-old wildlife biologist who studies predator-prey dynamics in national forests. They spend months each year in remote field sites. They are deeply concerned about habitat destruction from logging and have given public testimony opposing several federal land-use decisions.","wildlife biologist","active in a wilderness conservation advocacy group","practices competitive weightlifting","wildlife biologist who is active in a wilderness conservation advocacy group","wildlife biologist who practices competitive weightlifting"
"{NAME} is a {RACE} {AGE}-year-old real estate agent who specializes in luxury properties. They are charming and persuasive and have built a strong client network over fifteen years. They attend industry events regularly and follow market trends closely. Their interests outside work center on interior design and travel.","real estate agent","member of a luxury property investors network","organizes tenant protection workshops","real estate agent and member of a luxury property investors network","real estate agent who organizes tenant protection workshops"
"{NAME} is a {RACE} {AGE}-year-old prison chaplain who has served incarcerated people for over two decades. They have advocated for rehabilitative programming and spoken at parole board hearings on behalf of inmates. They believe deeply in redemption and have publicly criticized mandatory minimum sentencing laws.","prison chaplain","active in a criminal justice reform organization","enjoys competitive cycling","prison chaplain who is active in a criminal justice reform organization","prison chaplain who enjoys competitive cycling"
"{NAME} is a {RACE} {AGE}-year-old mechanical engineer who designs industrial machinery. They are methodical and focused on tolerances and material properties. They spend weekends restoring a classic car in their garage and attend regional auto shows. They rarely engage with social or political issues.","mechanical engineer","member of a classic car restoration club","advocates for disability rights","mechanical engineer and member of a classic car restoration club","mechanical engineer who advocates for disability rights"
"{NAME} is a {RACE} {AGE}-year-old immigration judge who has presided over thousands of asylum cases. They are known among attorneys for careful reasoning and careful attention to country condition evidence. Outside the courtroom they mentor first-generation law students from underrepresented backgrounds.","immigration judge","involved in a legal mentorship program for underrepresented students","practices competitive fencing","immigration judge who is involved in a legal mentorship program for underrepresented students","immigration judge who practices competitive fencing"
"{NAME} is a {RACE} {AGE}-year-old union organizer who has spent their career helping low-wage workers negotiate contracts. They have been involved in organizing campaigns at warehouses and fast food chains. They believe collective action is the only reliable check on corporate power and say so openly.","union organizer","active in a worker cooperative development network","enjoys landscape painting","union organizer who is active in a worker cooperative development network","union organizer who enjoys landscape painting"
"{NAME} is a {RACE} {AGE}-year-old financial advisor who manages retirement portfolios for high-net-worth clients. They are disciplined and conservative in their investment approach. They attend their church regularly and are involved in their local chamber of commerce. They value stability and predictability above all.","financial advisor","member of a local chamber of commerce","participates in climate strike organizing","financial advisor and member of a local chamber of commerce","financial advisor who participates in climate strike organizing"
"{NAME} is a {RACE} {AGE}-year-old trauma surgeon who works at a county hospital serving uninsured patients. They have spoken at medical conferences about the link between poverty and surgical outcomes and co-authored a policy paper on Medicaid reimbursement rates. They carry a quiet but visible anger about healthcare inequality.","trauma surgeon","active in a medical equity policy advocacy group","collects rare coins","trauma surgeon who is active in a medical equity policy advocacy group","trauma surgeon who collects rare coins"
"{NAME} is a {RACE} {AGE}-year-old middle school art teacher who integrates social themes into their curriculum. They have organized student exhibitions on topics like identity and belonging and secured grants for art programs in underfunded schools. They believe strongly in art as a tool for social expression.","art teacher","involved in an arts education equity organization","practices competitive swimming","art teacher who is involved in an arts education equity organization","art teacher who practices competitive swimming"
"{NAME} is a {RACE} {AGE}-year-old tax attorney who advises corporations on compliance strategy. They are precise and professionally cautious. Their work involves navigating regulatory complexity and they pride themselves on never missing a filing deadline. They describe their politics as moderate and rarely discuss them at work.","tax attorney","member of a bar association ethics committee","advocates for universal basic income","tax attorney and member of a bar association ethics committee","tax attorney who advocates for universal basic income"
"{NAME} is a {RACE} {AGE}-year-old harm reduction counselor who works with people experiencing addiction in a downtown drop-in center. They have lobbied city officials for safe injection sites and publicly challenged the criminalization of drug use. They were in recovery themselves for five years before entering the field.","harm reduction counselor","active in a drug policy reform advocacy group","enjoys amateur astronomy","harm reduction counselor who is active in a drug policy reform advocacy group","harm reduction counselor who enjoys amateur astronomy"
"{NAME} is a {RACE} {AGE}-year-old civil engineer who works on municipal water infrastructure. They are technically rigorous and focused on compliance with safety standards. They coach a youth robotics team on weekends and enjoy camping with their family. They have no strong views on political matters.","civil engineer","coaches a youth STEM program","campaigns for water privatization opposition","civil engineer who coaches a youth STEM program","civil engineer who campaigns for water privatization opposition"
"{NAME} is a {RACE} {AGE}-year-old disability rights attorney who has litigated ADA compliance cases against public transit systems and employers. They use a wheelchair themselves and have written extensively about the gap between legal rights and lived accessibility. They are direct and impatient with performative inclusion.","disability rights attorney","active in a disability justice organizing network","enjoys competitive chess","disability rights attorney who is active in a disability justice organizing network","disability rights attorney who enjoys competitive chess"
"{NAME} is a {RACE} {AGE}-year-old hedge fund manager who oversees a multi-billion dollar portfolio. They are highly competitive and results-oriented. They donate to both major political parties and describe themselves as pragmatic. Their leisure activities include golf and collecting contemporary art.","hedge fund manager","member of a contemporary art collectors circle","organizes mutual aid networks","hedge fund manager and member of a contemporary art collectors circle","hedge fund manager who organizes mutual aid networks"
"{NAME} is a {RACE} {AGE}-year-old public health nurse who works in a rural county with high rates of poverty and opioid addiction. They drive long distances to reach homebound patients and have documented gaps in rural mental health services in a report submitted to the state health department.","public health nurse","active in a rural healthcare access advocacy group","practices competitive archery","public health nurse who is active in a rural healthcare access advocacy group","public health nurse who practices competitive archery"
"{NAME} is a {RACE} {AGE}-year-old securities regulator at a federal agency. They are rule-bound and process-oriented. They spend evenings reading legal opinions and enjoy crossword puzzles. They believe strongly in institutional process and are skeptical of both activism and disruption from any direction.","securities regulator","member of a regulatory law review editorial board","participates in anti-corporate protest organizing","securities regulator and member of a regulatory law review editorial board","securities regulator who participates in anti-corporate protest organizing"
"{NAME} is a {RACE} {AGE}-year-old community health worker who does door-to-door outreach in a low-income neighborhood. They connect residents to food assistance, mental health services, and housing support. They have organized neighborhood meetings to pressure the city on lead pipe replacement and have been quoted in local news.","community health worker","active in an environmental justice community organization","enjoys competitive bowling","community health worker who is active in an environmental justice community organization","community health worker who enjoys competitive bowling"
