vignette,T,F,F_uncorrelated,T_and_F1,T_and_F2
"{NAME} is a {RACE} {AGE}-year-old forensic accountant who investigates financial fraud for a federal agency. They are methodical and evidence-driven. They spend weekends hiking with their dog and playing board games with friends. They describe themselves as politically disengaged and rarely vote.","forensic accountant","member of a board games enthusiast club","campaigns for campaign finance reform","forensic accountant and member of a board games enthusiast club","forensic accountant who campaigns for campaign finance reform"
"{NAME} is a {RACE} {AGE}-year-old resettlement caseworker who helps refugee families navigate housing, employment, and school enrollment. They speak two languages in addition to English and previously worked as a refugee themselves after fleeing conflict as a teenager. They advocate vocally for more generous asylum policy.","resettlement caseworker","active in a refugee rights advocacy coalition","enjoys competitive karate","resettlement caseworker who is active in a refugee rights advocacy coalition","resettlement caseworker who enjoys competitive karate"
"{NAME} is a {RACE} {AGE}-year-old civil rights attorney who has spent their career litigating voting rights cases in the South. They have challenged gerrymandering maps in federal court and represented plaintiffs in poll tax disputes. They are described by colleagues as relentless and entirely undeterred by losses.","civil rights attorney","active in a voting rights protection organization","enjoys model shipbuilding","civil rights attorney who is active in a voting rights protection organization","civil rights attorney who enjoys model shipbuilding"
"{NAME} is a {RACE} {AGE}-year-old petroleum engineer who works on offshore drilling platforms. They rotate between two-week shifts at sea and two weeks at home. They follow football closely and spend time off hunting and fishing with friends from college. They have no strong views on climate policy.","petroleum engineer","member of a hunting and fishing enthusiasts club","campaigns for fossil fuel divestment","petroleum engineer and member of a hunting and fishing enthusiasts club","petroleum engineer who campaigns for fossil fuel divestment"
"{NAME} is a {RACE} {AGE}-year-old hospice social worker who supports dying patients and their families through end-of-life decisions. They have advocated publicly for expanded palliative care funding and written about the isolation experienced by elderly patients in underfunded facilities. They carry grief carefully and with purpose.","hospice social worker","active in an elder care advocacy organization","enjoys competitive rowing","hospice social worker who is active in an elder care advocacy organization","hospice social worker who enjoys competitive rowing"
"{NAME} is a {RACE} {AGE}-year-old derivatives trader at a large investment bank. They thrive under pressure and are motivated by performance bonuses. They follow markets obsessively and spend weekends skiing and attending industry networking events. They are indifferent to most political causes.","derivatives trader","member of a ski club and alumni investment network","organizes mutual aid food pantries","derivatives trader and member of a ski club and alumni investment network","derivatives trader who organizes mutual aid food pantries"
"{NAME} is a {RACE} {AGE}-year-old bilingual elementary school teacher who works in a district with a large immigrant student population. They have advocated for expanded ESL resources and challenged the school board on a policy that restricted heritage language use in classrooms. They host parent nights in two languages.","elementary school teacher","active in an immigrant family education advocacy group","practices competitive fencing","elementary school teacher who is active in an immigrant family education advocacy group","elementary school teacher who practices competitive fencing"
"{NAME} is a {RACE} {AGE}-year-old microbiologist who researches antibiotic resistance at a university lab. They publish regularly in peer-reviewed journals and are meticulous about methodology. They spend weekends hiking and reading science history. They engage rarely with political issues and describe themselves as focused on the science.","microbiologist","member of a science communication and public health outreach group","campaigns for pharmaceutical price controls","microbiologist and member of a science communication and public health outreach group","microbiologist who campaigns for pharmaceutical price controls"
"{NAME} is a {RACE} {AGE}-year-old tenant rights organizer who works for a nonprofit in a rapidly gentrifying city. They have led rent strikes and helped dozens of families fight eviction in housing court. They are openly critical of real estate developers and have been escorted out of city council meetings twice.","tenant rights organizer","active in an anti-displacement housing justice coalition","enjoys competitive badminton","tenant rights organizer who is active in an anti-displacement housing justice coalition","tenant rights organizer who enjoys competitive badminton"
"{NAME} is a {RACE} {AGE}-year-old supply chain manager at a multinational consumer goods company. They oversee vendor relationships across three continents and are focused on efficiency and cost reduction. They travel frequently for work and spend downtime watching sports and cooking. They describe themselves as apolitical.","supply chain manager","member of a corporate efficiency and logistics professional network","advocates for fair trade labor standards","supply chain manager and member of a corporate efficiency and logistics professional network","supply chain manager who advocates for fair trade labor standards"
"{NAME} is a {RACE} {AGE}-year-old queer youth counselor who works at an LGBTQ community center. They provide support to teenagers who have been rejected by their families and have lobbied the state legislature against conversion therapy. They are publicly out and speak at schools about inclusion on request.","youth counselor","active in an LGBTQ rights advocacy organization","practices amateur telescope building","youth counselor who is active in an LGBTQ rights advocacy organization","youth counselor who practices amateur telescope building"
"{NAME} is a {RACE} {AGE}-year-old aerospace engineer who works on satellite navigation systems. They hold multiple patents and are known for precision and technical depth. They are politically conservative and donate to candidates who support defense spending. They spend weekends with their family and attend church regularly.","aerospace engineer","member of a defense industry professional association","organizes climate justice marches","aerospace engineer and member of a defense industry professional association","aerospace engineer who organizes climate justice marches"
"{NAME} is a {RACE} {AGE}-year-old reproductive health nurse practitioner who provides contraceptive and abortion care at a clinic in a conservative state. They have been trained in security protocols due to protest activity outside the clinic. They have testified before the state legislature and given media interviews defending access to care.","nurse practitioner","active in a reproductive rights advocacy organization","enjoys competitive archery","nurse practitioner who is active in a reproductive rights advocacy organization","nurse practitioner who enjoys competitive archery"
"{NAME} is a {RACE} {AGE}-year-old logistics software developer who builds route optimization tools. They are focused on technical problem-solving and dislike ambiguity. They play video games competitively in their spare time and follow esports. They have little interest in social causes and prefer to stay out of public debates.","software developer","member of an esports and gaming community group","campaigns for tech worker unionization","software developer and member of an esports and gaming community group","software developer who campaigns for tech worker unionization"
"{NAME} is a {RACE} {AGE}-year-old labor historian who teaches at a state university. They have written three books on the decline of manufacturing unions and are frequently quoted in labor coverage. They bring their students to picket lines as field trips and are openly sympathetic to collective bargaining.","labor historian","active in a labor studies and worker education organization","enjoys competitive sailing","labor historian who is active in a labor studies and worker education organization","labor historian who enjoys competitive sailing"
"{NAME} is a {RACE} {AGE}-year-old wealth management advisor who serves ultra-high-net-worth clients. They are discreet professional and focused on asset preservation. They serve on the board of a private arts foundation and spend summers in Europe. They have no interest in political causes and donate primarily to cultural institutions.","wealth management advisor","member of a private arts foundation board","organizes rent control ballot initiatives","wealth management advisor and member of a private arts foundation board","wealth management advisor who organizes rent control ballot initiatives"
"{NAME} is a {RACE} {AGE}-year-old wildfire firefighter who has battled fires across the western United States for twelve years. They have spoken publicly about how climate change is making their work more dangerous and testified before a congressional subcommittee on wildfire funding. They are direct and not given to politics except where it touches their work.","wildfire firefighter","active in a climate and public lands protection group","enjoys competitive chess","wildfire firefighter who is active in a climate and public lands protection group","wildfire firefighter who enjoys competitive chess"
"{NAME} is a {RACE} {AGE}-year-old immigration compliance officer at a corporation. They review employee visa documentation and ensure regulatory adherence. They are precise and process-oriented. They spend evenings gardening and follow professional cycling. They describe themselves as nonpolitical and prefer procedural clarity to public debate.","compliance officer","member of a cycling enthusiast club","advocates for sanctuary city policies","compliance officer and member of a cycling enthusiast club","compliance officer who advocates for sanctuary city policies"
"{NAME} is a {RACE} {AGE}-year-old food bank director who manages operations serving twenty thousand families per month. They have lobbied state legislators for expanded SNAP benefits and publicly criticized food deserts created by supermarket consolidation. They grew up food insecure themselves and speak about it openly.","food bank director","active in a food justice and hunger relief advocacy coalition","practices competitive billiards","food bank director who is active in a food justice and hunger relief advocacy coalition","food bank director who practices competitive billiards"
"{NAME} is a {RACE} {AGE}-year-old securities attorney at a law firm advising financial institutions. They are technically precise and focused on compliance and deal structure. They play golf regularly and sit on a university alumni advisory board. Their political giving is split between parties and driven by tax policy.","securities attorney","member of a university alumni advisory board","campaigns for student debt cancellation","securities attorney and member of a university alumni advisory board","securities attorney who campaigns for student debt cancellation"
"{NAME} is a {RACE} {AGE}-year-old clean water advocate who works for an environmental nonprofit in a region with contaminated groundwater. They have filed public records requests against municipal utilities and helped residents file class action claims against industrial polluters. They are angry methodical and press every legal avenue available.","clean water advocate","active in an environmental health justice organization","enjoys competitive table tennis","clean water advocate who is active in an environmental health justice organization","clean water advocate who enjoys competitive table tennis"
"{NAME} is a {RACE} {AGE}-year-old military officer who commands a logistics battalion. They are mission-focused and value discipline and chain of command. They mentor junior officers and believe strongly in institutional loyalty. They are apolitical by professional obligation and by personal preference.","military officer","active in a veterans leadership mentorship program","participates in anti-war protest organizing","military officer who is active in a veterans leadership mentorship program","military officer who participates in anti-war protest organizing"
"{NAME} is a {RACE} {AGE}-year-old special education teacher who works with students with severe cognitive and physical disabilities. They have fought with school administrations over inadequate aide staffing and testified at state budget hearings about cuts to disability services. They are patient fierce and completely dedicated to their students.","special education teacher","active in a disability education equity advocacy group","enjoys amateur winemaking","special education teacher who is active in a disability education equity advocacy group","special education teacher who enjoys amateur winemaking"
"{NAME} is a {RACE} {AGE}-year-old pharmaceutical sales representative who promotes medications to hospital physicians. They are polished persuasive and focused on meeting quarterly targets. They golf with clients and attend industry conferences. They have no strong political views and donate to their college alumni fund.","pharmaceutical sales representative","member of a golf and industry networking club","campaigns for drug price transparency legislation","pharmaceutical sales representative and member of a golf and industry networking club","pharmaceutical sales representative who campaigns for drug price transparency legislation"
"{NAME} is a {RACE} {AGE}-year-old immigration detention monitor who visits facilities on behalf of a civil liberties organization. They document conditions speak with detainees and file reports with oversight bodies. They have given depositions in federal litigation and are deeply committed to accountability in the immigration system.","detention monitor","active in a civil liberties and detention oversight organization","enjoys competitive squash","detention monitor who is active in a civil liberties and detention oversight organization","detention monitor who enjoys competitive squash"
"{NAME} is a {RACE} {AGE}-year-old forest products industry lobbyist who represents timber companies before state and federal agencies. They are skilled at relationship management and regulatory strategy. They hunt and fish regularly and are involved in their local chamber of commerce. They are skeptical of environmental regulation.","industry lobbyist","member of a hunting and fishing conservation club","advocates for old-growth forest preservation","industry lobbyist and member of a hunting and fishing conservation club","industry lobbyist who advocates for old-growth forest preservation"
"{NAME} is a {RACE} {AGE}-year-old maternal-fetal medicine specialist who works in a high-risk obstetrics unit. They have published research on racial disparities in maternal mortality and presented findings at national conferences. They have pushed their hospital to implement bias training for obstetric staff and spoken about this in medical media.","maternal-fetal medicine specialist","active in a maternal health equity research and advocacy group","enjoys competitive rock climbing","maternal-fetal medicine specialist who is active in a maternal health equity research and advocacy group","maternal-fetal medicine specialist who enjoys competitive rock climbing"
"{NAME} is a {RACE} {AGE}-year-old tax preparer who works at a small accounting firm serving working-class clients. They are methodical honest and focused on maximizing legal deductions for people who cannot afford mistakes. They spend evenings watching documentary films and have no strong political affiliations.","tax preparer","member of a documentary film enthusiast group","campaigns for progressive tax reform","tax preparer and member of a documentary film enthusiast group","tax preparer who campaigns for progressive tax reform"
"{NAME} is a {RACE} {AGE}-year-old water rights attorney who represents indigenous tribes in disputes over treaty-protected water access. They studied environmental law and indigenous studies and are deeply committed to tribal sovereignty. They have argued cases before the Ninth Circuit and speak at tribal colleges on legal empowerment.","water rights attorney","active in an indigenous sovereignty and environmental law organization","enjoys competitive bowling","water rights attorney who is active in an indigenous sovereignty and environmental law organization","water rights attorney who enjoys competitive bowling"
"{NAME} is a {RACE} {AGE}-year-old corporate communications director who manages public relations for a Fortune 500 company. They are polished strategic and skilled at managing reputational risk. They sit on the board of a local arts nonprofit and attend charity galas. They are careful about their public positions on controversial issues.","corporate communications director","member of a corporate philanthropy and arts nonprofit board","organizes labor solidarity campaigns","corporate communications director and member of a corporate philanthropy and arts nonprofit board","corporate communications director who organizes labor solidarity campaigns"
"{NAME} is a {RACE} {AGE}-year-old harm reduction outreach worker who distributes clean needles and naloxone in a city with high overdose rates. They have spoken at city council meetings opposing criminalization of drug use and helped draft a proposal for a supervised consumption site. Several people they work with have saved lives using naloxone they provided.","outreach worker","active in a drug policy and harm reduction advocacy coalition","enjoys competitive darts","outreach worker who is active in a drug policy and harm reduction advocacy coalition","outreach worker who enjoys competitive darts"
"{NAME} is a {RACE} {AGE}-year-old bond trader at a regional bank. They are analytical calm under pressure and focused on yield spreads and credit ratings. They coach their child's little league team on weekends and are active in their neighborhood homeowners association. They describe politics as mostly noise.","bond trader","active in a neighborhood homeowners association","campaigns for financial sector regulation","bond trader who is active in a neighborhood homeowners association","bond trader who campaigns for financial sector regulation"
"{NAME} is a {RACE} {AGE}-year-old climate scientist who has published extensively on Arctic ice melt and sea level projections. They have testified before Congress twice and appear regularly in documentary films about climate change. They are frustrated by political inaction and have increasingly moved toward public advocacy.","climate scientist","active in a science-based climate policy advocacy organization","enjoys competitive dressage","climate scientist who is active in a science-based climate policy advocacy organization","climate scientist who enjoys competitive dressage"
"{NAME} is a {RACE} {AGE}-year-old insurance underwriter who assesses risk for commercial property policies. They are systematic and risk-averse in both professional and personal life. They spend weekends gardening and attending their children's school events. They have no strong views on social issues and prefer routine.","insurance underwriter","member of a community garden cooperative","campaigns for climate liability legislation","insurance underwriter and member of a community garden cooperative","insurance underwriter who campaigns for climate liability legislation"
"{NAME} is a {RACE} {AGE}-year-old public defender in a capital case unit who represents clients facing the death penalty. They have won three exonerations through post-conviction litigation. They are publicly opposed to capital punishment and have spoken at abolition rallies. They describe the work as morally urgent and personally consuming.","public defender","active in a death penalty abolition organization","enjoys competitive orienteering","public defender who is active in a death penalty abolition organization","public defender who enjoys competitive orienteering"
"{NAME} is a {RACE} {AGE}-year-old hotel operations manager who oversees a large downtown property. They are focused on guest experience metrics and staff scheduling efficiency. They enjoy craft beer and travel in their personal time and are active in their city's hospitality industry association. They have little interest in political organizing.","hotel operations manager","member of a hospitality industry professional association","campaigns for hotel worker union rights","hotel operations manager and member of a hospitality industry professional association","hotel operations manager who campaigns for hotel worker union rights"
"{NAME} is a {RACE} {AGE}-year-old urban farmer who runs a cooperative growing operation on reclaimed vacant lots in a food desert. They have pushed city hall for zoning relief and grant funding and helped establish a sliding-scale produce stand. They see food production as political and speak about land access and food sovereignty regularly.","urban farmer","active in a food sovereignty and community land access organization","enjoys competitive table tennis","urban farmer who is active in a food sovereignty and community land access organization","urban farmer who enjoys competitive table tennis"
"{NAME} is a {RACE} {AGE}-year-old radiologist who reads imaging scans at a suburban hospital. They work independently and value the intellectual precision of diagnostic work. They play tennis on weekends and are involved in a local wine appreciation group. They have no public profile and prefer to keep a low presence outside work.","radiologist","member of a wine appreciation and tasting club","advocates for universal healthcare","radiologist and member of a wine appreciation and tasting club","radiologist who advocates for universal healthcare"
"{NAME} is a {RACE} {AGE}-year-old domestic violence advocate who works at a shelter for survivors. They have lobbied for stronger protective order enforcement and trained police officers on trauma-informed response. They have personal experience with abuse and speak about it in advocacy contexts when they choose to.","domestic violence advocate","active in a gender-based violence prevention and policy organization","enjoys competitive swimming","domestic violence advocate who is active in a gender-based violence prevention and policy organization","domestic violence advocate who enjoys competitive swimming"
"{NAME} is a {RACE} {AGE}-year-old currency trader at a global bank. They work in fast-moving markets and are driven by short-term performance. They are competitive focused and financially motivated. They spend leisure time playing poker and following Formula One racing. They have no interest in social causes.","currency trader","member of a poker and strategy games enthusiast group","organizes economic justice teach-ins","currency trader and member of a poker and strategy games enthusiast group","currency trader who organizes economic justice teach-ins"
"{NAME} is a {RACE} {AGE}-year-old special immigrant visa caseworker who helps Afghan and Iraqi military interpreters navigate the US immigration process. They have testified before Congress on processing backlogs and spoken publicly about the moral obligation the US has to those who risked their lives working with American forces.","immigration caseworker","active in a refugee and military ally advocacy coalition","enjoys competitive pickleball","immigration caseworker who is active in a refugee and military ally advocacy coalition","immigration caseworker who enjoys competitive pickleball"
"{NAME} is a {RACE} {AGE}-year-old sports medicine physician who works with a professional athletics team. They are performance-focused and technically precise. They spend off-seasons trail running and are involved in a charitable golf tournament that benefits youth athletics programs. They rarely engage with political topics publicly.","sports medicine physician","active in a youth athletics and community health foundation","campaigns for NFL concussion litigation reform","sports medicine physician who is active in a youth athletics and community health foundation","sports medicine physician who campaigns for NFL concussion litigation reform"
"{NAME} is a {RACE} {AGE}-year-old public transit bus driver who has worked the same route through a low-income neighborhood for eleven years. They know many of their regular riders by name. They have spoken at transit authority board meetings about unsafe working conditions and are active in their drivers union.","bus driver","active in a public transit workers union","enjoys competitive sudoku","bus driver who is active in a public transit workers union","bus driver who enjoys competitive sudoku"
"{NAME} is a {RACE} {AGE}-year-old private equity attorney who advises on leveraged buyouts and portfolio company restructuring. They bill over three hundred hours per month and are known for their negotiating precision. They are involved in their firm's pro bono program in a limited administrative capacity. They donate to centrist political candidates.","private equity attorney","member of a corporate law professional advisory board","campaigns for private equity regulation","private equity attorney and member of a corporate law professional advisory board","private equity attorney who campaigns for private equity regulation"
